<ZF440N_kurzusfelvetel tanev="2023/24_I" egyetem="ME" xmlns:xs="http://www.w3.org/2001/XMLSchema-instance"
xs:noNamespaceSchemaLocation="ZF440N_kurzusfelvetel.xsd">

    <hallgato id="ZF440N.ME">
        <hnev>Kórád György</hnev>
        <szulev>2000-10-06</szulev>
        <szak evf="5"> Programtervező Informatikus </szak>
    </hallgato>
    <kurzusok>
        <kurzus id="GEIAL331-B" nyelv="magyar">
            <kurzusnev>WEB technológiák 1</kurzusnev>
            <kredit>5</kredit>
            <hely>A1 315</hely>
            <idopont>Hétfő 14:00-18:00</idopont>
            <oktato>Agárdi Anita</oktato>
        </kurzus>

        <kurzus id="GEMAK234-B" nyelv="magyar">
            <kurzusnev>Algoritmusok és vizsgálatuk</kurzusnev>
            <kredit>5</kredit>
            <hely>A1 320</hely>
            <idopont>Kedd 14:00-18:00</idopont>
            <oktato>Házy Attila</oktato>
        </kurzus>

        <kurzus id="GEMAK232-B" nyelv="magyar">
            <kurzusnev>Valószínűség-számítás</kurzusnev>
            <kredit>5</kredit>
            <hely>A1 320</hely>
            <idopont>Hétfő 10:00-12:00</idopont>
            <oktato>Dr. Fegyverneki Sándor</oktato>
        </kurzus>

        <kurzus id="GEIAK130-B" nyelv="magyar">
            <kurzusnev>Mesterséges intelligencia alapok</kurzusnev>
            <kredit>5</kredit>
            <hely>A1 32.EA</hely>
            <idopont>Kedd 10:00-12:00</idopont>
            <oktato>Kunné Dr. Tamási Judit</oktato>
            <oraado>Fazekas Levente</oraado>
        </kurzus>

        <kurzus id="GEIAL332-B" nyelv="magyar">
            <kurzusnev>Adatkezelés XML-ben</kurzusnev>
            <kredit>5</kredit>
            <hely>A1 32.EA</hely>
            <idopont>Kedd 12:00-14:00</idopont>
            <oktato>Dr. Bednarik László</oktato>
        </kurzus>

    </kurzusok>
</ZF440N_kurzusfelvetel>